{
  "artifact_type": "scale_ladder_report",
  "created_at": "2026-06-28T00:00:00Z",
  "phase_id": "P23_FAULT_NETWORK_DELAY_LOSS_FLAP",
  "producer": {
    "name": "valkey-scale-lab",
    "version": "0.0.0"
  },
  "run_id": "P23_FAULT_NETWORK_DELAY_LOSS_FLAP-scale-ladder-20260628",
  "rungs": [
    {
      "artifact_type": "scale_rung_summary",
      "az_distribution": {
        "az-a": 5,
        "az-b": 5
      },
      "client_port_range": {
        "max": 7669,
        "min": 7660
      },
      "cluster_known_nodes_observed": [
        10,
        10,
        10,
        10,
        10,
        10,
        10,
        10,
        10,
        10
      ],
      "cluster_states": [
        "ok"
      ],
      "config_path": "p23_10",
      "created_at": "2026-06-28T00:00:00Z",
      "errors": [],
      "evidence_path": "artifacts/phases/P23_FAULT_NETWORK_DELAY_LOSS_FLAP/valkey_e2e_evidence_10.json",
      "host_distribution": {
        "p23-host-a": 4,
        "p23-host-b": 3,
        "p23-host-c": 3
      },
      "management": {
        "cluster_known_nodes_expected": 10,
        "cluster_known_nodes_max": 10,
        "cluster_known_nodes_min": 10,
        "slot_ranges": [
          {
            "end": 9829,
            "start": 6553
          },
          {
            "end": 13106,
            "start": 9830
          },
          {
            "end": 16383,
            "start": 13107
          },
          {
            "end": 3275,
            "start": 0
          },
          {
            "end": 6552,
            "start": 3276
          }
        ],
        "slots_assigned": 16384
      },
      "metrics": {
        "avg_used_memory": 3035260.0,
        "total_commands_processed": 326,
        "total_used_memory": 30352600
      },
      "node_count": 10,
      "phase_id": "P23_FAULT_NETWORK_DELAY_LOSS_FLAP",
      "primary_count": 5,
      "producer": {
        "name": "valkey-scale-lab",
        "version": "0.0.0"
      },
      "replica_count": 5,
      "run_id": "P23_FAULT_NETWORK_DELAY_LOSS_FLAP-p23_fault_matrix_10-20260628",
      "rung": 10,
      "scenario": "p23_fault_matrix_10",
      "schema_version": "v1",
      "status": "PASS",
      "valkey_versions": [
        "9.1.0"
      ]
    }
  ],
  "schema_version": "v1",
  "status": "PASS",
  "summary": {
    "comparison": {
      "reason": "At least two completed rungs are needed for comparison.",
      "status": "SKIPPED_WITH_REASON"
    },
    "max_nodes_observed": 10,
    "real_evidence_paths": [
      "artifacts/phases/P23_FAULT_NETWORK_DELAY_LOSS_FLAP/valkey_e2e_evidence_10.json"
    ],
    "rung_counts_observed": [
      10
    ]
  }
}
